{
  "version": 1,
  "generated": "2026-04-26T00:00:00Z+snap:15716eae5c41",
  "source_snapshot_sha256": {
    "grow_contact_lex_customs.json": "a2fe74e4d656302aac995f11832990db0bdec3b172ae1090450a17f4e7908666",
    "grow_locations.json": "90f0444fdda7a26f1254412e95c8e86d4806edef638f62fd3610b306a9bcc7f5",
    "grow_matter_lex_customs.json": "66a78cdf3a5bcd00911bde39cee054abd9b8e1ff1981880e489492c5942fab91",
    "grow_matter_statuses.json": "fb737ad10eee3a89c48a3a742ab526bf890b35b66304e294e7782091e071dade",
    "grow_matter_types.json": "e14efd3584be488424705fe8bb977f6d511304a6a358baa6bccdad77b49f70e9",
    "manage_contact_custom_field_sets.json": "c0b81c183e84bc09464a7e42cdbf45ab15d316526e488e55bb0860e8a7affecb",
    "manage_contact_custom_fields.json": "43179e320f51786398086a22dd321b54ac3a6350efbb50f883abec26579498e4",
    "manage_matter_custom_field_sets.json": "7cfdfb375ba20cd9703eb4a2c4b19427e62af5d3e178ac8f671c19b4f2de1e9f",
    "manage_matter_custom_fields.json": "c0822cb1b560afdd5c68aeef12f41b602ca97df0eaf44664f2b03c9d5b1df5a8",
    "manage_practice_area_assets.json": "fc6cf2de6656ff8676f248b499caaa34125a00bcb6286a0bfc241dec70dbd1f1",
    "manage_practice_areas.json": "b1cfb9b1662ea88ea60b2ef344d3ada50d4a1cbfadf766f2dd5e71b0965a27ba"
  },
  "entries": [
    {
      "grow_field_name": "Employer",
      "grow_field_id": 1034234,
      "manage_field_id": 9455556,
      "manage_field_name": "Employer",
      "canonical_name": "employer",
      "type": "text",
      "transformer": "trim_text",
      "validation_rules": {},
      "drift_severity": "low",
      "side": "matter",
      "grow_only": false
    },
    {
      "grow_field_name": "Jurisdiction",
      "grow_field_id": 1034237,
      "manage_field_id": 9455571,
      "manage_field_name": "Jurisdiction",
      "canonical_name": "jurisdiction",
      "type": "text",
      "transformer": "trim_text",
      "validation_rules": {},
      "drift_severity": "low",
      "side": "matter",
      "grow_only": false
    },
    {
      "grow_field_name": "Position",
      "grow_field_id": 1034240,
      "manage_field_id": 9455586,
      "manage_field_name": "Position",
      "canonical_name": "position",
      "type": "text",
      "transformer": "trim_text",
      "validation_rules": {},
      "drift_severity": "low",
      "side": "matter",
      "grow_only": false
    },
    {
      "grow_field_name": "Years of Service",
      "grow_field_id": 1034246,
      "manage_field_id": 9455616,
      "manage_field_name": "Years of Service",
      "canonical_name": "years_of_service",
      "type": "text",
      "transformer": "trim_text",
      "validation_rules": {},
      "drift_severity": "low",
      "side": "matter",
      "grow_only": false
    },
    {
      "grow_field_name": "Employment Status",
      "grow_field_id": 1034249,
      "manage_field_id": null,
      "manage_field_name": null,
      "canonical_name": "employment_status",
      "type": "single_select",
      "transformer": "select_trim",
      "validation_rules": {},
      "drift_severity": "high",
      "side": "matter",
      "grow_only": true,
      "notes": "Grow-only field; no Manage equivalent. Conversion-time data loss flagged for Pass 7 auto-population design."
    },
    {
      "grow_field_name": "Notice Offered",
      "grow_field_id": 1034252,
      "manage_field_id": 9455646,
      "manage_field_name": "Notice Offered ",
      "canonical_name": "notice_offered",
      "type": "text",
      "transformer": "trim_text",
      "validation_rules": {},
      "drift_severity": "low",
      "side": "matter",
      "grow_only": false
    },
    {
      "grow_field_name": "Contract?",
      "grow_field_id": 1061099,
      "manage_field_id": 9681291,
      "manage_field_name": "Contract?",
      "canonical_name": "contract",
      "type": "text",
      "transformer": "trim_text",
      "validation_rules": {},
      "drift_severity": "medium",
      "side": "matter",
      "grow_only": false,
      "notes": "Type mismatch: Grow declares text (check_box), Manage declares boolean (checkbox). Values normalized via trim_text; review at extraction."
    },
    {
      "grow_field_name": "Contract",
      "grow_field_id": 1034255,
      "manage_field_id": null,
      "manage_field_name": null,
      "canonical_name": "contract_growonly",
      "type": "text",
      "transformer": "trim_text",
      "validation_rules": {},
      "drift_severity": "high",
      "side": "matter",
      "grow_only": true,
      "notes": "Grow-only field; no Manage equivalent. Conversion-time data loss flagged for Pass 7 auto-population design."
    },
    {
      "grow_field_name": "Documents on File",
      "grow_field_id": 1034261,
      "manage_field_id": 9455691,
      "manage_field_name": "Documents on File",
      "canonical_name": "documents_on_file",
      "type": "paragraph_text",
      "transformer": "trim_text",
      "validation_rules": {},
      "drift_severity": "low",
      "side": "matter",
      "grow_only": false
    },
    {
      "grow_field_name": "Start Date",
      "grow_field_id": 1034264,
      "manage_field_id": 9455721,
      "manage_field_name": "Start Date",
      "canonical_name": "start_date",
      "type": "date",
      "transformer": "date_iso",
      "validation_rules": {},
      "drift_severity": "low",
      "side": "matter",
      "grow_only": false
    },
    {
      "grow_field_name": "Termination Date",
      "grow_field_id": 1034267,
      "manage_field_id": 9455736,
      "manage_field_name": "Termination Date",
      "canonical_name": "termination_date",
      "type": "date",
      "transformer": "date_iso",
      "validation_rules": {},
      "drift_severity": "low",
      "side": "matter",
      "grow_only": false
    },
    {
      "grow_field_name": "Mitigation Status",
      "grow_field_id": 1034270,
      "manage_field_id": 9455751,
      "manage_field_name": "Mitigation Status",
      "canonical_name": "mitigation_status",
      "type": "text",
      "transformer": "trim_text",
      "validation_rules": {},
      "drift_severity": "low",
      "side": "matter",
      "grow_only": false
    },
    {
      "grow_field_name": "Reason for Termination",
      "grow_field_id": 1034546,
      "manage_field_id": 9457311,
      "manage_field_name": "Reason for Termination",
      "canonical_name": "reason_for_termination",
      "type": "paragraph_text",
      "transformer": "trim_text",
      "validation_rules": {},
      "drift_severity": "low",
      "side": "matter",
      "grow_only": false
    },
    {
      "grow_field_name": "Annual Salary",
      "grow_field_id": 1034549,
      "manage_field_id": 9457446,
      "manage_field_name": "Annual Salary",
      "canonical_name": "annual_salary",
      "type": "text",
      "transformer": "trim_text",
      "validation_rules": {},
      "drift_severity": "low",
      "side": "matter",
      "grow_only": false
    },
    {
      "grow_field_name": "Terminated",
      "grow_field_id": 1034552,
      "manage_field_id": 9457461,
      "manage_field_name": "Terminated",
      "canonical_name": "terminated",
      "type": "text",
      "transformer": "trim_text",
      "validation_rules": {},
      "drift_severity": "medium",
      "side": "matter",
      "grow_only": false,
      "notes": "Type mismatch: Grow declares text (check_box), Manage declares boolean (checkbox). Values normalized via trim_text; review at extraction."
    },
    {
      "grow_field_name": "Sign on Termination",
      "grow_field_id": 1034555,
      "manage_field_id": 9457506,
      "manage_field_name": "Sign on Termination",
      "canonical_name": "sign_on_termination",
      "type": "text",
      "transformer": "trim_text",
      "validation_rules": {},
      "drift_severity": "medium",
      "side": "matter",
      "grow_only": false,
      "notes": "Type mismatch: Grow declares text (check_box), Manage declares boolean (checkbox). Values normalized via trim_text; review at extraction."
    },
    {
      "grow_field_name": "Salary (yr,mo,wk)",
      "grow_field_id": 1035263,
      "manage_field_id": 9458076,
      "manage_field_name": "Salary (yr,mo,wk)",
      "canonical_name": "salary_yr_mo_wk",
      "type": "paragraph_text",
      "transformer": "trim_text",
      "validation_rules": {},
      "drift_severity": "low",
      "side": "matter",
      "grow_only": false
    },
    {
      "grow_field_name": "Contingency % (words lwrcse)",
      "grow_field_id": 1035323,
      "manage_field_id": 9466521,
      "manage_field_name": "Contingency % (words lwrcse)",
      "canonical_name": "contingency_words_lwrcse",
      "type": "text",
      "transformer": "trim_text",
      "validation_rules": {},
      "drift_severity": "low",
      "side": "matter",
      "grow_only": false
    },
    {
      "grow_field_name": "ESA Entitlements",
      "grow_field_id": 1041245,
      "manage_field_id": 9476586,
      "manage_field_name": "ESA Entitlements",
      "canonical_name": "esa_entitlements",
      "type": "integer",
      "transformer": "integer_parse",
      "validation_rules": {},
      "drift_severity": "low",
      "side": "matter",
      "grow_only": false
    },
    {
      "grow_field_name": "Warnings (written or verbal)",
      "grow_field_id": 1041248,
      "manage_field_id": 9476631,
      "manage_field_name": "Warnings (written or verbal)",
      "canonical_name": "warnings_written_or_verbal",
      "type": "paragraph_text",
      "transformer": "trim_text",
      "validation_rules": {},
      "drift_severity": "low",
      "side": "matter",
      "grow_only": false
    },
    {
      "grow_field_name": "Retainer & ID",
      "grow_field_id": 1041251,
      "manage_field_id": 9561906,
      "manage_field_name": "Retainer & ID",
      "canonical_name": "retainer_id",
      "type": "single_select",
      "transformer": "select_trim",
      "validation_rules": {},
      "drift_severity": "low",
      "side": "matter",
      "grow_only": false
    },
    {